{
  "schema_version": "2",
  "domains": [
    {"id": "agent-coordination", "docs": ["AGENTS.md", "docs/agent-coordination.md", "docs/architecture-boundary-review.md", "docs/architecture/architecture-review-governance.md", "docs/architecture/decisions/DEC-0001-foundation-closure.json", "docs/architecture/decisions/index.json", "docs/architecture/vss-constitution.md", "docs/security/threat-model.md"], "code": ["config/agent-harness-v2.json", "scripts/validate-change.sh", "scripts/vss-agent", "src/vss_assurance"], "tests": ["tests/agent_coordination"]},
    {"id": "architecture", "docs": ["docs/adr", "docs/reasoning-contracts.md"], "code": ["schemas"], "tests": ["tests/architecture", "tests/reasoning_contracts", "tests/resource_contracts"]},
    {"id": "configuration", "docs": ["config", "docs/adr/ADR-0003-configuration-management-strategy.md"], "code": ["src/vss_config"], "tests": ["tests/config_engine"]},
    {"id": "dev-milestone", "docs": ["docs/agent-coordination.md", "docs/architecture/decisions/DEC-0001-foundation-closure.json", "docs/architecture/decisions/index.json", "docs/security/threat-model.md"], "code": ["config/dev-milestone-policy-v1.json", "schemas/dev-milestone-execution-packet-v1.schema.json", "schemas/dev-milestone-policy-v1.schema.json", "schemas/dev-milestone-record-v1.schema.json", "src/vss_commands/cli.py", "src/vss_dev"], "tests": ["tests/dev_milestone"]},
    {"id": "infrastructure", "docs": ["infrastructure/contracts"], "code": ["ansible", "infrastructure"], "tests": ["tests/iac_contract"]},
    {"id": "movie", "docs": ["docs/movie-scene-breakdown.md", "docs/movie-scene-contracts.md", "docs/movie-scene-production-options.md"], "code": ["src/vss_movie_canon", "src/vss_movie_contracts", "src/vss_movie_demo", "src/vss_movie_option_review", "src/vss_movie_production_options", "src/vss_movie_scene_breakdown", "src/vss_movie_shot_plan", "src/vss_movie_storyboard", "src/vss_resource_admission", "src/vss_resource_contracts"], "tests": ["tests/movie_canon", "tests/movie_contracts", "tests/movie_option_review", "tests/movie_production_options", "tests/movie_scene_breakdown", "tests/movie_shot_plan", "tests/movie_storyboard", "tests/resource_admission"]},
    {"id": "reasoning", "docs": ["docs/reasoning-contracts.md"], "code": ["src/vss_reasoning", "src/vss_reasoning_contracts", "src/vss_reasoning_providers", "src/vss_reasoning_strategies"], "tests": ["tests/reasoning", "tests/reasoning_contracts"]},
    {"id": "runtime", "docs": ["docs/adr/ADR-0010-capability-oriented-runtime-kernel.md", "docs/adr/ADR-0016-autonomy-approval-execution-authority.md"], "code": ["capabilities/runtime", "src/vss_capabilities", "src/vss_runtime"], "tests": ["tests/runtime"]},
    {"id": "security", "docs": ["DEPENDENCY-POLICY.md", "OSS-POLICY.md", "SECURITY.md", "docs/security"], "code": ["scripts/security", "security"], "tests": ["tests/security"]}
  ],
  "profiles": [
    {"id": "agent-coordination-tests", "level": "L1", "argv": ["python", "-m", "unittest", "discover", "-s", "tests/agent_coordination", "-p", "test_*.py"]},
    {"id": "architecture-tests", "level": "L2", "argv": ["python", "-m", "unittest", "discover", "-s", "tests/architecture", "-p", "test_*.py"]},
    {"id": "canonical", "level": "L3", "argv": ["./scripts/validate-change.sh"]},
    {"id": "configuration-tests", "level": "L1", "argv": ["python", "-m", "unittest", "discover", "-s", "tests/config_engine", "-p", "test_*.py"]},
    {"id": "dev-milestone-tests", "level": "L1", "argv": ["python", "-m", "unittest", "discover", "-s", "tests/dev_milestone", "-p", "test_*.py"]},
    {"id": "harness-l0", "level": "L0", "argv": ["./scripts/validate-change.sh", "--level", "L0"]},
    {"id": "movie-contract-tests", "level": "L1", "argv": ["python", "-m", "unittest", "discover", "-s", "tests/movie_contracts", "-p", "test_*.py"]},
    {"id": "movie-scene-breakdown-tests", "level": "L1", "argv": ["python", "-m", "unittest", "discover", "-s", "tests/movie_scene_breakdown", "-p", "test_*.py"]},
    {"id": "movie-shot-plan-tests", "level": "L1", "argv": ["python", "-m", "unittest", "discover", "-s", "tests/movie_shot_plan", "-p", "test_*.py"]},
    {"id": "movie-storyboard-tests", "level": "L1", "argv": ["python", "-m", "unittest", "discover", "-s", "tests/movie_storyboard", "-p", "test_*.py"]},
    {"id": "reasoning-contract-tests", "level": "L1", "argv": ["python", "-m", "unittest", "discover", "-s", "tests/reasoning_contracts", "-p", "test_*.py"]},
    {"id": "reasoning-tests", "level": "L1", "argv": ["python", "-m", "unittest", "discover", "-s", "tests/reasoning", "-p", "test_*.py"]},
    {"id": "runtime-tests", "level": "L1", "argv": ["python", "-m", "unittest", "discover", "-s", "tests/runtime", "-p", "test_*.py"]},
    {"id": "security-tests", "level": "L2", "argv": ["python", "-m", "unittest", "discover", "-s", "tests/security", "-p", "test_*.py"]}
  ],
  "impact_rules": [
    {"pattern": ".github/**", "domain": "agent-coordination", "minimum_level": "L3", "risk": "shared", "profiles": ["canonical"], "obligations": ["ci.exact_head", "dependency.subject_enumeration", "milestone.validation", "mission.alignment", "mission.review_receipts", "repo.impact_union", "workflow.exact_ci"], "effect_scope": "all_affected_subjects"},
    {"pattern": "AGENTS.md", "domain": "agent-coordination", "minimum_level": "L3", "risk": "shared", "profiles": ["canonical"], "obligations": ["ci.exact_head", "milestone.validation", "mission.alignment", "mission.review_receipts", "repo.impact_union"], "effect_scope": "exact_registered_subject"},
    {"pattern": "config/agent-harness-v2.json", "domain": "agent-coordination", "minimum_level": "L3", "risk": "shared", "profiles": ["canonical"], "obligations": ["ci.exact_head", "dependency.subject_enumeration", "milestone.validation", "mission.alignment", "mission.review_receipts", "policy.controller_self_change", "repo.impact_union"], "effect_scope": "all_affected_subjects"},
    {"pattern": "config/dev-milestone-policy-v1.json", "domain": "dev-milestone", "minimum_level": "L3", "risk": "shared", "profiles": ["canonical"], "obligations": ["ci.exact_head", "dependency.subject_enumeration", "milestone.validation", "mission.alignment", "mission.review_receipts", "policy.controller_self_change", "repo.impact_union"], "effect_scope": "all_affected_subjects"},
    {"pattern": "docs/**", "domain": "architecture", "minimum_level": "L0", "risk": "docs", "profiles": ["harness-l0"], "obligations": ["ci.exact_head", "milestone.validation", "mission.alignment", "mission.review_receipts", "repo.impact_union"], "effect_scope": "exact_registered_subject"},
    {"pattern": "schemas/**", "domain": "architecture", "minimum_level": "L2", "risk": "shared", "profiles": ["architecture-tests", "security-tests"], "obligations": ["ci.exact_head", "dependency.subject_enumeration", "milestone.validation", "mission.alignment", "mission.review_receipts", "repo.impact_union", "schema.consumer_closure"], "effect_scope": "all_affected_subjects"},
    {"pattern": "schemas/agent-harness-v2.schema.json", "domain": "agent-coordination", "minimum_level": "L3", "risk": "shared", "profiles": ["canonical"], "obligations": ["ci.exact_head", "dependency.subject_enumeration", "milestone.validation", "mission.alignment", "mission.review_receipts", "repo.impact_union", "schema.consumer_closure"], "effect_scope": "all_affected_subjects"},
    {"pattern": "schemas/agent-validation-evidence-v1.schema.json", "domain": "agent-coordination", "minimum_level": "L3", "risk": "shared", "profiles": ["canonical"], "obligations": ["ci.exact_head", "dependency.subject_enumeration", "milestone.validation", "mission.alignment", "mission.review_receipts", "repo.impact_union", "schema.consumer_closure"], "effect_scope": "all_affected_subjects"},
    {"pattern": "schemas/assurance-assessment-request-v1.schema.json", "domain": "agent-coordination", "minimum_level": "L2", "risk": "shared", "profiles": ["agent-coordination-tests"], "obligations": ["ci.exact_head", "dependency.subject_enumeration", "milestone.validation", "mission.alignment", "mission.review_receipts", "policy.controller_self_change", "repo.impact_union", "schema.consumer_closure"], "effect_scope": "all_affected_subjects"},
    {"pattern": "schemas/assurance-assessment-result-v1.schema.json", "domain": "agent-coordination", "minimum_level": "L2", "risk": "shared", "profiles": ["agent-coordination-tests"], "obligations": ["ci.exact_head", "dependency.subject_enumeration", "milestone.validation", "mission.alignment", "mission.review_receipts", "policy.controller_self_change", "repo.impact_union", "schema.consumer_closure"], "effect_scope": "all_affected_subjects"},
    {"pattern": "schemas/dev-milestone-execution-packet-v1.schema.json", "domain": "dev-milestone", "minimum_level": "L3", "risk": "shared", "profiles": ["canonical"], "obligations": ["ci.exact_head", "dependency.subject_enumeration", "milestone.validation", "mission.alignment", "mission.review_receipts", "policy.controller_self_change", "repo.impact_union", "schema.consumer_closure"], "effect_scope": "all_affected_subjects"},
    {"pattern": "schemas/dev-milestone-policy-v1.schema.json", "domain": "dev-milestone", "minimum_level": "L3", "risk": "shared", "profiles": ["canonical"], "obligations": ["ci.exact_head", "dependency.subject_enumeration", "milestone.validation", "mission.alignment", "mission.review_receipts", "policy.controller_self_change", "repo.impact_union", "schema.consumer_closure"], "effect_scope": "all_affected_subjects"},
    {"pattern": "schemas/dev-milestone-record-v1.schema.json", "domain": "dev-milestone", "minimum_level": "L3", "risk": "shared", "profiles": ["canonical"], "obligations": ["ci.exact_head", "dependency.subject_enumeration", "milestone.validation", "mission.alignment", "mission.review_receipts", "policy.controller_self_change", "repo.impact_union", "schema.consumer_closure"], "effect_scope": "all_affected_subjects"},